id,tender_id,source_portal,title_clean,country_name_normalized,sector,procurement_group,budget,currency,days_to_deadline,status_normalized,lifecycle_stage,notice_type_normalized,procurement_method_name,organisation_name,funding_agency,enrichment_status,go_no_go,score_breakdown
13373,1285,undp,ACQUISITION DES LOGICIELS POUR LA DRE,Haiti,"[""Others""]",Others,,,230,open,procurement,Request for Quotation,RFQ - Request for quotation,UNDP-HTI,United Nations Development Programme (UNDP),nlp_complete,0,proc_group=OTHERS(1.5) | sector=Others(0.0) | budget=unknown(1.0) | country=Haiti(tier3=1.0) | funding_agency=United Nations Development Programme (UNDP)(3.0) | deadline=230d(low_urgency=0.5) | TOTAL=7.0/13.0 → NO GO
13374,1286,ungm,"136282 EJECUCIÓN DE ACTIVIDADES SILVÍCOLAS Y DE PROTECCIÓN CONTRA INCENDIOS FORESTALES, REGIÓN DE LA ARAUCANÍA",Chile,"[""Environment & Climate"", ""Mining & Natural Resources""]",Others,,,9,open,procurement,Invitation for Bids,,FAO,FAO,nlp_complete,0,proc_group=OTHERS(1.5) | sector=Environment & Climate(1.0) | budget=unknown(1.0) | country=Chile(tier3=1.0) | funding_agency=FAO(1.0) | deadline=9d(very_urgent=3.0) | TOTAL=8.5/13.0 → NO GO
13375,1287,ungm,Wash Facilities and Canteen at Balata GS2 and Askar BS2- Nablus Area for Local Contractors only,Palestine,"[""Water, Sanitation & Waste""]",Others,,,1,open,procurement,Invitation for Bids,,UNRWA,UNRWA,nlp_complete,0,"proc_group=OTHERS(1.5) | sector=Water, Sanitation & Waste(1.0) | budget=unknown(1.0) | country=Palestine(tier2=2.0) | funding_agency=UNRWA(unknown=1.0) | deadline=1d(too_urgent=DISQUALIFIED) | TOTAL=0.0 → NO GO (disqualified)"
13376,1288,ungm,Adquisición de licencia y equipamiento de modelaje industrial,Argentina,"[""Others""]",GOODS,,,1,open,procurement,Request for Quotation,,UNOPS,UNOPS,nlp_complete,0,proc_group=GOODS(DISQUALIFIED) | sector=Others(0.0) | budget=unknown(1.0) | country=Argentina(tier3=1.0) | funding_agency=UNOPS(3.0) | deadline=1d(too_urgent=DISQUALIFIED) | TOTAL=0.0 → NO GO (disqualified)
13377,1289,ungm,"Contratación de una empresa proveedora servicios logísticos para la realización de 3 talleres en la ciudad de Asunción, Paraguay - Oficina de Proyectos OIT Asunción",Paraguay,"[""Enterprise IT & Systems Implementation""]",Others,,,5,open,procurement,Request for Quotation,,ILO,ILO,nlp_complete,0,proc_group=OTHERS(1.5) | sector=Enterprise IT & Systems Implementation(3.0) | budget=unknown(1.0) | country=Paraguay(tier3=1.0) | funding_agency=ILO(3.0) | deadline=5d(too_urgent=DISQUALIFIED) | TOTAL=0.0 → NO GO (disqualified)
13378,1290,ungm,"RFQ Construction Contract for Small Works - Construction of Al-Mansoura Therapeutic Feeding Centre (TFC) – Al-Mansoura District, Beer Fadhl- Aden Republic of Yemen",Yemen,"[""Others""]",WORKS,,,1,open,procurement,Request for Quotation,,UNOPS,UNOPS,nlp_complete,0,proc_group=WORKS(DISQUALIFIED) | sector=Others(0.0) | budget=unknown(1.0) | country=Yemen(tier2=2.0) | funding_agency=UNOPS(3.0) | deadline=1d(too_urgent=DISQUALIFIED) | TOTAL=0.0 → NO GO (disqualified)
13379,1291,ungm,APPEL D'OFFRES POUR L’INSTALLATION DE SERRES AGRICOLES ET DE SYSTEMES D’IRRIGATION SUR LE SITE DE LA Food and Agriculture Organization GUINEE,Guinea,"[""Others""]",WORKS,,,3,open,procurement,Invitation for Bids,,FAO,FAO,nlp_complete,0,proc_group=WORKS(DISQUALIFIED) | sector=Others(0.0) | budget=unknown(1.0) | country=Guinea(tier1=3.0) | funding_agency=FAO(1.0) | deadline=3d(too_urgent=DISQUALIFIED) | TOTAL=0.0 → NO GO (disqualified)
13380,1292,ungm,"Evaluation of the Project - “Strategic-Technical Support to the Jal Jeevan Mission""",India,"[""Business Strategy & Performance""]",CONSULTING,,,6,open,procurement,Request for Quotation,,UNOPS,UNOPS,nlp_complete,0,proc_group=CONSULTING(3.0) | sector=Business Strategy & Performance(3.0) | budget=unknown(1.0) | country=India(tier3=1.0) | funding_agency=UNOPS(3.0) | deadline=6d(too_urgent=DISQUALIFIED) | TOTAL=0.0 → NO GO (disqualified)
13381,1293,ungm,Fourniture et la livraison de petits matériels agricoles et d’ustensiles de cuisine à livrer dans le Sud de Madagascar,Madagascar,"[""Agriculture & Food Security""]",GOODS,,,14,open,procurement,Invitation for Bids,,FAO,FAO,nlp_complete,0,proc_group=GOODS(DISQUALIFIED) | sector=Agriculture & Food Security(1.0) | budget=unknown(1.0) | country=Madagascar(tier1=3.0) | funding_agency=FAO(1.0) | deadline=14d(very_urgent=3.0) | TOTAL=0.0 → NO GO (disqualified)
13382,1294,ungm,services for the development of a full design package for site development and the construction of a greenhouse platform,Armenia,"[""Construction & Infrastructure""]",WORKS,,,6,open,procurement,Request for Quotation,,FAO,FAO,nlp_complete,0,proc_group=WORKS(DISQUALIFIED) | sector=Construction & Infrastructure(1.0) | budget=unknown(1.0) | country=Armenia(tier2=2.0) | funding_agency=FAO(1.0) | deadline=6d(too_urgent=DISQUALIFIED) | TOTAL=0.0 → NO GO (disqualified)
13383,1295,ungm,Hosting Capacity Building Session in Nathia Gali (18 to 24 April 2026),Pakistan,"[""Construction & Infrastructure""]",CONSULTING,,,16,open,procurement,Request for Quotation,,IOM,IOM,nlp_complete,0,proc_group=CONSULTING(3.0) | sector=Construction & Infrastructure(1.0) | budget=unknown(1.0) | country=Pakistan(tier3=1.0) | funding_agency=IOM(1.0) | deadline=16d(urgent=2.0) | TOTAL=9.0/13.0 → NO GO
13384,1296,ungm,CONSULTATION POUR LA FOURNITURE DES EQUIPEMENTS DE CLIMATISATION,Tunisia,"[""Environment & Climate""]",GOODS,,,6,open,procurement,Request for Quotation,,IOM,IOM,nlp_complete,0,proc_group=GOODS(DISQUALIFIED) | sector=Environment & Climate(1.0) | budget=unknown(1.0) | country=Tunisia(tier1=3.0) | funding_agency=IOM(1.0) | deadline=6d(too_urgent=DISQUALIFIED) | TOTAL=0.0 → NO GO (disqualified)
13385,1297,ungm,Development of National OSH Policy and Implementation Framework for Pakistan,Pakistan,"[""Enterprise IT & Systems Implementation""]",Others,,,13,open,procurement,Expression of Interest,,ILO,ILO,nlp_complete,0,proc_group=OTHERS(1.5) | sector=Enterprise IT & Systems Implementation(3.0) | budget=unknown(1.0) | country=Pakistan(tier3=1.0) | funding_agency=ILO(3.0) | deadline=13d(very_urgent=3.0) | TOTAL=12.5/13.0 → NO GO
13386,1298,ungm,Provision of Photography Tour Package - SafeDay 2026 Campaign,Viet Nam,"[""Marketing & Customer Experience""]",GOODS,,,12,open,procurement,Request for Quotation,,ILO,ILO,nlp_complete,0,proc_group=GOODS(DISQUALIFIED) | sector=Marketing & Customer Experience(2.0) | budget=unknown(1.0) | country=Viet Nam(tier3=1.0) | funding_agency=ILO(3.0) | deadline=12d(very_urgent=3.0) | TOTAL=0.0 → NO GO (disqualified)
13387,1299,ungm,Employment Impact Assessment in Pakistan: Implications of the Crisis in the Arab Region and Pakistan–Afghanistan Tensions on Workers and Labour Market in Pakistan,Pakistan,"[""Employment & Skills Development""]",CONSULTING,,,13,open,procurement,Expression of Interest,,ILO,ILO,nlp_complete,1,proc_group=CONSULTING(3.0) | sector=Employment & Skills Development(2.0) | budget=unknown(1.0) | country=Pakistan(tier3=1.0) | funding_agency=ILO(3.0) | deadline=13d(very_urgent=3.0) | TOTAL=13.0/13.0 → GO
13388,1300,ungm,"Services for the Translation of the Child Functioning Module in Three Local Languages (Filipino, Cebuano and Waray)",Philippines,"[""Others""]",Others,,,13,open,procurement,Request for Proposals,,UNICEF,UNICEF,nlp_complete,0,proc_group=OTHERS(1.5) | sector=Others(0.0) | budget=unknown(1.0) | country=Philippines(tier3=1.0) | funding_agency=UNICEF(1.5) | deadline=13d(very_urgent=3.0) | TOTAL=8.0/13.0 → NO GO
13389,1301,ungm,"Enterprise (Occupational Health, Safety and Electronic Medical Records) Management Software",Multiple Destinations,"[""Enterprise IT & Systems Implementation""]",Others,,,9,,,Request for information,,UN Secretariat,UN Secretariat,nlp_complete,0,proc_group=OTHERS(1.5) | sector=Enterprise IT & Systems Implementation(3.0) | budget=unknown(1.0) | country=Multiple Destinations(tier3=1.0) | funding_agency=UN Secretariat(unknown=1.0) | deadline=9d(very_urgent=3.0) | TOTAL=10.5/13.0 → NO GO
13390,1302,ungm,Advancing Community-based Mental Health and Psychosocial Support and Suicide Prevention in Cambodia,Cambodia,"[""Social Protection & Poverty Reduction""]",Others,,,1,open,procurement,Request for Proposals,,WHO,WHO,nlp_complete,0,proc_group=OTHERS(1.5) | sector=Social Protection & Poverty Reduction(1.5) | budget=unknown(1.0) | country=Cambodia(tier3=1.0) | funding_agency=WHO(1.0) | deadline=1d(too_urgent=DISQUALIFIED) | TOTAL=0.0 → NO GO (disqualified)
13391,1303,ungm,Develop interactive e-learning experience for Early Childhood Development (ECD) teachers in Thailand,Thailand,"[""Education & Training""]",Others,,,9,open,procurement,Request for Proposals,,UNICEF,UNICEF,nlp_complete,0,proc_group=OTHERS(1.5) | sector=Education & Training(1.0) | budget=unknown(1.0) | country=Thailand(tier3=1.0) | funding_agency=UNICEF(1.5) | deadline=9d(very_urgent=3.0) | TOTAL=9.0/13.0 → NO GO
13392,1304,ungm,Recrutement d’un(e) consultant(e) externe pour la relecture et la finalisation de la traduction des manuels GERME en langue malagasy,Madagascar,"[""Others""]",CONSULTING,,,4,open,procurement,Expression of Interest,,ILO,ILO,nlp_complete,0,proc_group=CONSULTING(3.0) | sector=Others(0.0) | budget=unknown(1.0) | country=Madagascar(tier1=3.0) | funding_agency=ILO(3.0) | deadline=4d(too_urgent=DISQUALIFIED) | TOTAL=0.0 → NO GO (disqualified)
13393,1305,ungm,"Recrutement d’un(e) Maître Formateur(trice) GERME pour la formation, la mise à niveau et la certification de formateurs International Labour Organization/MDG/RFQ/2026/48- ERR",Madagascar,"[""Education & Training"", ""Risk & Compliance""]",CONSULTING,,,4,open,procurement,Expression of Interest,,ILO,ILO,nlp_complete,0,proc_group=CONSULTING(3.0) | sector=Risk & Compliance(3.0) | budget=unknown(1.0) | country=Madagascar(tier1=3.0) | funding_agency=ILO(3.0) | deadline=4d(too_urgent=DISQUALIFIED) | TOTAL=0.0 → NO GO (disqualified)
13394,1306,ungm,International Institutional Consultancy to Develop a Climate Rationale and Facilitate a Joint Sector Review for the WASH Sector in Tajikistan,Tajikistan,"[""Environment & Climate""]",CONSULTING,,,1,open,procurement,Request for Proposals,,UNICEF,UNICEF,nlp_complete,0,proc_group=CONSULTING(3.0) | sector=Environment & Climate(1.0) | budget=unknown(1.0) | country=Tajikistan(tier3=1.0) | funding_agency=UNICEF(1.5) | deadline=1d(too_urgent=DISQUALIFIED) | TOTAL=0.0 → NO GO (disqualified)
13395,1307,ungm,Mise en place d'accords à long terme (4 ans) d'hébergement et d'organisation d'ateliers de l'UNESCO au nom de toutes les agences du Système des Nations Unies en Côte d'Ivoire,Côte D'Ivoire,"[""Others""]",Others,,,0,open,procurement,Expression of Interest,,UNESCO,UNESCO,nlp_complete,0,proc_group=OTHERS(1.5) | sector=Others(0.0) | budget=unknown(1.0) | country=Côte D'Ivoire(tier1=3.0) | funding_agency=UNESCO(2.0) | deadline=0d(too_urgent=DISQUALIFIED) | TOTAL=0.0 → NO GO (disqualified)
13396,1308,ungm,"Call for Expressions of interest (EOI) - Social Business Solutions (1st Batch) Business Development Grants for Entrepreneurs, SME's and Cooperatives/Associations - UNIDO Programme ""Poverty Alleviation and Inclusive Development Across Rural Sindh"" (PAIDAR",Pakistan,"[""Social Protection & Poverty Reduction""]",Others,,,20,open,procurement,Expression of Interest,,UNIDO,UNIDO,nlp_complete,0,proc_group=OTHERS(1.5) | sector=Social Protection & Poverty Reduction(1.5) | budget=unknown(1.0) | country=Pakistan(tier3=1.0) | funding_agency=UNIDO(3.0) | deadline=20d(urgent=2.0) | TOTAL=10.0/13.0 → NO GO
13397,1309,ungm,"Provision of services related to ""Capacity building through training and mentorship to local trainers (ToT) and start-ups selection and incubation""",Iraq,"[""Education & Training""]",CONSULTING,,,1,open,procurement,Request for Quotation,,UNIDO,UNIDO,nlp_complete,0,proc_group=CONSULTING(3.0) | sector=Education & Training(1.0) | budget=unknown(1.0) | country=Iraq(tier2=2.0) | funding_agency=UNIDO(3.0) | deadline=1d(too_urgent=DISQUALIFIED) | TOTAL=0.0 → NO GO (disqualified)
13398,1310,ungm,LRFP 9203186 for the Medical equipment for Ministry of Health,Egypt,"[""Health & Life Sciences""]",GOODS,,,1,open,procurement,Request for Proposals,,UNICEF,UNICEF,nlp_complete,0,proc_group=GOODS(DISQUALIFIED) | sector=Health & Life Sciences(1.0) | budget=unknown(1.0) | country=Egypt(tier1=3.0) | funding_agency=UNICEF(1.5) | deadline=1d(too_urgent=DISQUALIFIED) | TOTAL=0.0 → NO GO (disqualified)
13399,1311,ungm,"PURCHASE OF TOOLS FOR TECHNICIANS AND WORKSHOPS UNDER PHILIPPINES HCFC PHASE-OUT MANAGEMENT PLAN STAGE III 190173 Your Bid must be submitted in TWO (2) SEPARATE PARTS, one of which shall contain the Technical Bid without price(s) and commercial terms via",Philippines,"[""Enterprise IT & Systems Implementation"", ""Organizational Reform & HR Management""]",GOODS,,,7,open,procurement,Invitation for Bids,,UNIDO,UNIDO,nlp_complete,0,proc_group=GOODS(DISQUALIFIED) | sector=Enterprise IT & Systems Implementation(3.0) | budget=unknown(1.0) | country=Philippines(tier3=1.0) | funding_agency=UNIDO(3.0) | deadline=7d(very_urgent=3.0) | TOTAL=0.0 → NO GO (disqualified)
13400,1312,ungm,Provision of Pest & Vector Control and Ground Maintenance Services,Haiti,"[""Risk & Compliance""]",NON-CONSULTING,,,6,open,procurement,Expression of Interest,,UN Secretariat,UN Secretariat,nlp_complete,0,proc_group=NON-CONSULTING(1.0) | sector=Risk & Compliance(3.0) | budget=unknown(1.0) | country=Haiti(tier3=1.0) | funding_agency=UN Secretariat(unknown=1.0) | deadline=6d(too_urgent=DISQUALIFIED) | TOTAL=0.0 → NO GO (disqualified)
13401,1313,ungm,Accords à Long Terme (LTA) avec des Prestataires de Services Financiers pour les Mécanismes de Transfert d’Assistance en Cash au Bénin,Benin,"[""Social Protection & Poverty Reduction"", ""Financial Services""]",Others,,,7,open,procurement,Request for Proposals,,IOM,IOM,nlp_complete,0,proc_group=OTHERS(1.5) | sector=Financial Services(3.0) | budget=unknown(1.0) | country=Benin(tier1=3.0) | funding_agency=IOM(1.0) | deadline=7d(very_urgent=3.0) | TOTAL=12.5/13.0 → NO GO
13402,1314,ungm,"Provision of services related to Development, Validation, Piloting, and Accreditation Support of ESG Training Curricula for India’s Machinery Sector",India,"[""Enterprise IT & Systems Implementation"", ""Risk & Compliance""]",GOODS,,,19,open,procurement,Request for Proposals,,UNIDO,UNIDO,nlp_complete,0,proc_group=GOODS(DISQUALIFIED) | sector=Enterprise IT & Systems Implementation(3.0) | budget=unknown(1.0) | country=India(tier3=1.0) | funding_agency=UNIDO(3.0) | deadline=19d(urgent=2.0) | TOTAL=0.0 → NO GO (disqualified)
13403,1315,ungm,"Scope of Work for Space Renovation and Furnishing of SiCalidad Paraguay – Project Office in Asuncion, Paraguay",Paraguay,"[""Construction & Infrastructure""]",WORKS,,,13,open,procurement,Request for Quotation,,UNIDO,UNIDO,nlp_complete,0,proc_group=WORKS(DISQUALIFIED) | sector=Construction & Infrastructure(1.0) | budget=unknown(1.0) | country=Paraguay(tier3=1.0) | funding_agency=UNIDO(3.0) | deadline=13d(very_urgent=3.0) | TOTAL=0.0 → NO GO (disqualified)
13404,1316,ungm,"RfQ_Events Management Services_TLT Seghe, April 2026",Solomon Islands,"[""Marketing & Customer Experience""]",GOODS,,,14,open,procurement,Request for Quotation,,UN-Women,UN-Women,nlp_complete,0,proc_group=GOODS(DISQUALIFIED) | sector=Marketing & Customer Experience(2.0) | budget=unknown(1.0) | country=Solomon Islands(tier3=1.0) | funding_agency=UN-Women(unknown=1.0) | deadline=14d(very_urgent=3.0) | TOTAL=0.0 → NO GO (disqualified)
13405,1317,ungm,Supply of Physiotherapy Items (for Gaza Supplier only),Palestine,"[""Health & Life Sciences""]",GOODS,,,12,open,procurement,Invitation for Bids,,UNRWA,UNRWA,nlp_complete,0,proc_group=GOODS(DISQUALIFIED) | sector=Health & Life Sciences(1.0) | budget=unknown(1.0) | country=Palestine(tier2=2.0) | funding_agency=UNRWA(unknown=1.0) | deadline=12d(very_urgent=3.0) | TOTAL=0.0 → NO GO (disqualified)
13406,1318,ungm,LITB-2026-9203187 for the provision of BMS Kit in Lebanon,Lebanon,"[""Others""]",GOODS,,,12,open,procurement,Invitation for Bids,,UNICEF,UNICEF,nlp_complete,0,proc_group=GOODS(DISQUALIFIED) | sector=Others(0.0) | budget=unknown(1.0) | country=Lebanon(tier2=2.0) | funding_agency=UNICEF(1.5) | deadline=12d(very_urgent=3.0) | TOTAL=0.0 → NO GO (disqualified)
13407,1319,ungm,"Transport Hire for Young Women Leadership Training, in Lae, Kokopo & Hagen",Papua New Guinea,"[""Transport & Logistics"", ""Organizational Reform & HR Management""]",Others,,,14,open,procurement,Request for Quotation,,UN-Women,UN-Women,nlp_complete,0,proc_group=OTHERS(1.5) | sector=Organizational Reform & HR Management(3.0) | budget=unknown(1.0) | country=Papua New Guinea(tier3=1.0) | funding_agency=UN-Women(unknown=1.0) | deadline=14d(very_urgent=3.0) | TOTAL=10.5/13.0 → NO GO
13408,1320,ungm,RFQ - Catering Services 8th to 30th April 2026,Nigeria,"[""Government Reform & Public Administration""]",NON-CONSULTING,,,19,open,procurement,Request for Quotation,,ILO,ILO,nlp_complete,1,proc_group=NON-CONSULTING(1.0) | sector=Government Reform & Public Administration(3.0) | budget=unknown(1.0) | country=Nigeria(tier1=3.0) | funding_agency=ILO(3.0) | deadline=19d(urgent=2.0) | TOTAL=13.0/13.0 → GO
13409,1321,ungm,Compra de elementos pedagógicos,Colombia,"[""Education & Training""]",GOODS,,,11,open,procurement,Request for Quotation,,IOM,IOM,nlp_complete,0,proc_group=GOODS(DISQUALIFIED) | sector=Education & Training(1.0) | budget=unknown(1.0) | country=Colombia(tier3=1.0) | funding_agency=IOM(1.0) | deadline=11d(very_urgent=3.0) | TOTAL=0.0 → NO GO (disqualified)
13410,1322,ungm,Adquisición de Ventiladores Mecánicos para la Provincia de Chubut,Argentina,"[""Others""]",GOODS,,,1,open,procurement,Invitation for Bids,,UNOPS,UNOPS,nlp_complete,0,proc_group=GOODS(DISQUALIFIED) | sector=Others(0.0) | budget=unknown(1.0) | country=Argentina(tier3=1.0) | funding_agency=UNOPS(3.0) | deadline=1d(too_urgent=DISQUALIFIED) | TOTAL=0.0 → NO GO (disqualified)
13411,1323,ungm,SERVICIOS ADMINISTRADOS DE PERSONAL PARA LA GESTIÓN DE EXPEDIENTES DE REGULARIZA,Costa Rica,"[""Risk & Compliance"", ""Organizational Reform & HR Management""]",Others,,,7,open,procurement,Request for Quotation,,IOM,IOM,nlp_complete,0,proc_group=OTHERS(1.5) | sector=Risk & Compliance(3.0) | budget=unknown(1.0) | country=Costa Rica(tier3=1.0) | funding_agency=IOM(1.0) | deadline=7d(very_urgent=3.0) | TOTAL=10.5/13.0 → NO GO
13412,1324,ungm,Installation of Irrigation and Aquaculture equipment in Trinidad and Tobago,Trinidad And Tobago,"[""Agriculture & Food Security""]",WORKS,,,1,open,procurement,Request for Proposals,,FAO,FAO,nlp_complete,0,proc_group=WORKS(DISQUALIFIED) | sector=Agriculture & Food Security(1.0) | budget=unknown(1.0) | country=Trinidad And Tobago(tier3=1.0) | funding_agency=FAO(1.0) | deadline=1d(too_urgent=DISQUALIFIED) | TOTAL=0.0 → NO GO (disqualified)
13413,1325,ungm,"AQUISIÇÃO DE DRONES, RECEPTORES GNSS RTK E RTX (ACQUISITION OF DRONES AND GNSS RECEIVERS L1/L2 RTK AND RTX)",Brazil,"[""Others""]",GOODS,,,1,open,procurement,Invitation for Bids,,FAO,FAO,nlp_complete,0,proc_group=GOODS(DISQUALIFIED) | sector=Others(0.0) | budget=unknown(1.0) | country=Brazil(tier3=1.0) | funding_agency=FAO(1.0) | deadline=1d(too_urgent=DISQUALIFIED) | TOTAL=0.0 → NO GO (disqualified)
13414,1326,ungm,Contrato Institucional para Análise de Dados em Imunização,Brazil,"[""Data, AI & Analytics""]",Others,,,0,open,procurement,Request for Proposals,,UNICEF,UNICEF,nlp_complete,0,"proc_group=OTHERS(1.5) | sector=Data, AI & Analytics(2.0) | budget=unknown(1.0) | country=Brazil(tier3=1.0) | funding_agency=UNICEF(1.5) | deadline=0d(too_urgent=DISQUALIFIED) | TOTAL=0.0 → NO GO (disqualified)"
13415,1327,ungm,COL RFQ CO42000005047 DOTACION,Colombia,"[""Others""]",Others,,,15,open,procurement,Request for Quotation,,IOM,IOM,nlp_complete,0,proc_group=OTHERS(1.5) | sector=Others(0.0) | budget=unknown(1.0) | country=Colombia(tier3=1.0) | funding_agency=IOM(1.0) | deadline=15d(urgent=2.0) | TOTAL=6.5/13.0 → NO GO
13416,1328,ungm,Contratación de servicios para el desarrollo de software para la automatización de los formularios de Seguimiento de plagas y Evaluación de riesgo ABRIL 2026,Ecuador,"[""Enterprise IT & Systems Implementation""]",Others,,,5,open,procurement,Request for Proposals,,FAO,FAO,nlp_complete,0,proc_group=OTHERS(1.5) | sector=Enterprise IT & Systems Implementation(3.0) | budget=unknown(1.0) | country=Ecuador(tier3=1.0) | funding_agency=FAO(1.0) | deadline=5d(too_urgent=DISQUALIFIED) | TOTAL=0.0 → NO GO (disqualified)
13417,1329,ungm,Adquisición de Equipos Médicos de diferentes especialidades para atención hospitalaria por Acuerdos a Largo Plazo (LTA) - Proceso 2,Honduras,"[""Health & Life Sciences""]",GOODS,,,2,open,procurement,Invitation for Bids,,UNOPS,UNOPS,nlp_complete,0,proc_group=GOODS(DISQUALIFIED) | sector=Health & Life Sciences(1.0) | budget=unknown(1.0) | country=Honduras(tier3=1.0) | funding_agency=UNOPS(3.0) | deadline=2d(too_urgent=DISQUALIFIED) | TOTAL=0.0 → NO GO (disqualified)
13418,1330,ungm,Call for External Collaborator – National Occupational Safety and Health Consultant for ACCEL Africa II Project- Ghana,Ghana,"[""Health & Life Sciences""]",CONSULTING,,,10,open,procurement,Expression of Interest,,ILO,ILO,nlp_complete,1,proc_group=CONSULTING(3.0) | sector=Health & Life Sciences(1.0) | budget=unknown(1.0) | country=Ghana(tier1=3.0) | funding_agency=ILO(3.0) | deadline=10d(very_urgent=3.0) | TOTAL=14.0/13.0 → GO
13419,1331,ungm,Fertilizantes para la producción de granos básicos (Maíz y Frijol) y Cultivos Nativos bajo sistemas sostenibles resilientes al clima,Guatemala,"[""Agriculture & Food Security""]",Others,,,0,open,procurement,Request for Quotation,,FAO,FAO,nlp_complete,0,proc_group=OTHERS(1.5) | sector=Agriculture & Food Security(1.0) | budget=unknown(1.0) | country=Guatemala(tier3=1.0) | funding_agency=FAO(1.0) | deadline=0d(too_urgent=DISQUALIFIED) | TOTAL=0.0 → NO GO (disqualified)
13420,1332,ungm,Fortalecimiento económico a proyectos productivos,Colombia,"[""Business Strategy & Performance""]",Others,,,20,open,procurement,Request for Quotation,,IOM,IOM,nlp_complete,0,proc_group=OTHERS(1.5) | sector=Business Strategy & Performance(3.0) | budget=unknown(1.0) | country=Colombia(tier3=1.0) | funding_agency=IOM(1.0) | deadline=20d(urgent=2.0) | TOTAL=9.5/13.0 → NO GO
13421,1333,ungm,Recrutement d’un cabinet-Expert pour la digitalisation de la plateforme d’information Nutritionnelle et de Sécurité Alimentaire,Burundi,"[""Data, AI & Analytics"", ""Digital Transformation""]",CONSULTING,,,7,open,procurement,Invitation for Bids,,FAO,FAO,nlp_complete,1,proc_group=CONSULTING(3.0) | sector=Digital Transformation(3.0) | budget=unknown(1.0) | country=Burundi(tier1=3.0) | funding_agency=FAO(1.0) | deadline=7d(very_urgent=3.0) | TOTAL=14.0/13.0 → GO
13422,1334,ungm,"Cargo Airlift (transportation) from Juba to Malakal 20MT, valued at $70,000",South Sudan,"[""Transport & Logistics""]",Others,,,18,open,procurement,Request for Quotation,,IOM,IOM,nlp_complete,0,proc_group=OTHERS(1.5) | sector=Transport & Logistics(1.0) | budget=unknown(1.0) | country=South Sudan(tier1=3.0) | funding_agency=IOM(1.0) | deadline=18d(urgent=2.0) | TOTAL=9.5/13.0 → NO GO
13423,1335,ungm,"Provision of Domestic Return Air Tickets - Uyo, Bauchi, Sokoto and Lagos",Nigeria,"[""Others""]",GOODS,,,15,open,procurement,Request for Quotation,,ILO,ILO,nlp_complete,0,proc_group=GOODS(DISQUALIFIED) | sector=Others(0.0) | budget=unknown(1.0) | country=Nigeria(tier1=3.0) | funding_agency=ILO(3.0) | deadline=15d(urgent=2.0) | TOTAL=0.0 → NO GO (disqualified)
13424,1336,ungm,ITB for Rice Seeds,Sudan,"[""Agriculture & Food Security""]",WORKS,,,5,open,procurement,Invitation for Bids,,FAO,FAO,nlp_complete,0,proc_group=WORKS(DISQUALIFIED) | sector=Agriculture & Food Security(1.0) | budget=unknown(1.0) | country=Sudan(tier1=3.0) | funding_agency=FAO(1.0) | deadline=5d(too_urgent=DISQUALIFIED) | TOTAL=0.0 → NO GO (disqualified)
13425,1337,ungm,Request for bid for Vehicle Accessories,Ghana,"[""Others""]",GOODS,,,14,open,procurement,Request for Quotation,,ILO,ILO,nlp_complete,0,proc_group=GOODS(DISQUALIFIED) | sector=Others(0.0) | budget=unknown(1.0) | country=Ghana(tier1=3.0) | funding_agency=ILO(3.0) | deadline=14d(very_urgent=3.0) | TOTAL=0.0 → NO GO (disqualified)
13426,1338,ungm,HQ. - Coaching for the start-up phase of National Pineapple Cooperative in Suriname,Suriname,"[""Agriculture & Food Security""]",CONSULTING,,,14,open,procurement,Request for Proposals,,ILO,ILO,nlp_complete,0,proc_group=CONSULTING(3.0) | sector=Agriculture & Food Security(1.0) | budget=unknown(1.0) | country=Suriname(tier3=1.0) | funding_agency=ILO(3.0) | deadline=14d(very_urgent=3.0) | TOTAL=12.0/13.0 → NO GO
13427,1339,ungm,Achat des réactifs pour analyse bromatologique des aliments pour lapins,Burundi,"[""Others""]",GOODS,,,0,open,procurement,Invitation for Bids,,FAO,FAO,nlp_complete,0,proc_group=GOODS(DISQUALIFIED) | sector=Others(0.0) | budget=unknown(1.0) | country=Burundi(tier1=3.0) | funding_agency=FAO(1.0) | deadline=0d(too_urgent=DISQUALIFIED) | TOTAL=0.0 → NO GO (disqualified)
13428,1340,ungm,Travaux de maintenance de la toiture du bâtiment salle de formation NEDEX au Camp Kassaï,Central African Republic,"[""Construction & Infrastructure""]",CONSULTING,,,6,open,procurement,Request for Quotation,,UNOPS,UNOPS,nlp_complete,0,proc_group=CONSULTING(3.0) | sector=Construction & Infrastructure(1.0) | budget=unknown(1.0) | country=Central African Republic(tier1=3.0) | funding_agency=UNOPS(3.0) | deadline=6d(too_urgent=DISQUALIFIED) | TOTAL=0.0 → NO GO (disqualified)
