id,tender_id,source_portal,title_clean,country_name_normalized,sector,procurement_group,budget,currency,days_to_deadline,status_normalized,lifecycle_stage,notice_type_normalized,procurement_method_name,organisation_name,funding_agency,enrichment_status,go_no_go,score_breakdown
12496,408,worldbank,Urban Productive Safety Net and Jobs Project,Ethiopia,"[""Social Protection & Poverty Reduction"", ""Risk & Compliance""]",GOODS,1000.0,ETB,19,open,procurement,Invitation for Bids,Request for Bids,Oromya Regional State Urban Development and Housing Bureau,World Bank,nlp_complete,0,proc_group=GOODS(DISQUALIFIED) | sector=Risk & Compliance(3.0) | budget=small(920€)(0.5) | country=Ethiopia(tier1=3.0) | funding_agency=World Bank(3.0) | deadline=19d(urgent=2.0) | TOTAL=0.0 → NO GO (disqualified)
12497,409,worldbank,Improvement of Solid Waste Management to Support Regional and Metropolitan Cities,Indonesia,"[""Water, Sanitation & Waste""]",GOODS,,,12,open,procurement,Invitation for Bids,Request for Bids,Balai Prasana Permukiman Wilayah Sumatera Barat,World Bank,nlp_complete,0,"proc_group=GOODS(DISQUALIFIED) | sector=Water, Sanitation & Waste(1.0) | budget=unknown(1.0) | country=Indonesia(tier3=1.0) | funding_agency=World Bank(3.0) | deadline=12d(very_urgent=3.0) | TOTAL=0.0 → NO GO (disqualified)"
12498,410,worldbank,Empowering Women Entrepreneurs and Upgrading MSMEs for Economic Transformation and Jobs in DRC Proje,Congo,"[""Business Strategy & Performance""]",WORKS,1500000.0,USD,6,open,procurement,Invitation for Bids,Request for Bids,Ministry of Entrepreneurship and Small Medium Enterprises,World Bank,nlp_complete,0,"proc_group=WORKS(DISQUALIFIED) | sector=Business Strategy & Performance(3.0) | budget=large(1,380,000€)(3.0) | country=Congo(tier1=3.0) | funding_agency=World Bank(3.0) | deadline=6d(too_urgent=DISQUALIFIED) | TOTAL=0.0 → NO GO (disqualified)"
12499,411,worldbank,Inclusive Services and Opportunities for Host Communities and Displaced Rohingya Population,Bangladesh,"[""Social Protection & Poverty Reduction""]",GOODS,,,18,open,procurement,Invitation for Bids,Request for Bids,Directorate of Primary Education,World Bank,nlp_complete,0,proc_group=GOODS(DISQUALIFIED) | sector=Social Protection & Poverty Reduction(1.5) | budget=unknown(1.0) | country=Bangladesh(tier3=1.0) | funding_agency=World Bank(3.0) | deadline=18d(urgent=2.0) | TOTAL=0.0 → NO GO (disqualified)
12500,412,worldbank,"Bangladesh Sustainable Recovery, Emergency Preparedness and Response Project",Bangladesh,"[""Social Protection & Poverty Reduction"", ""Environment & Climate""]",WORKS,,,19,open,procurement,Invitation for Bids,Request for Bids,Bangladesh Water Development Board,World Bank,nlp_complete,0,proc_group=WORKS(DISQUALIFIED) | sector=Social Protection & Poverty Reduction(1.5) | budget=unknown(1.0) | country=Bangladesh(tier3=1.0) | funding_agency=World Bank(3.0) | deadline=19d(urgent=2.0) | TOTAL=0.0 → NO GO (disqualified)
12501,413,worldbank,Sub-Saharan Africa Women’s Empowerment and Demographic Dividend Plus Project,Western And Central Africa,"[""Social Protection & Poverty Reduction""]",GOODS,200000.0,XOF,7,open,procurement,Invitation for Bids,Request for Bids,Sahel Women’s Empowerment and Demographics Project Chad,World Bank,nlp_complete,0,proc_group=GOODS(DISQUALIFIED) | sector=Social Protection & Poverty Reduction(1.5) | budget=small(300€)(0.5) | country=Western And Central Africa(tier1=3.0) | funding_agency=World Bank(3.0) | deadline=7d(very_urgent=3.0) | TOTAL=0.0 → NO GO (disqualified)
12502,414,worldbank,Togo Digital Acceleration Project,Togo,"[""Digital Transformation""]",GOODS,7678.0,DZD,9,open,procurement,Invitation for Bids,Request for Bids,Togo Digital Acceleration Project,World Bank,nlp_complete,0,proc_group=GOODS(DISQUALIFIED) | sector=Digital Transformation(3.0) | budget=small(53€)(0.5) | country=Togo(tier1=3.0) | funding_agency=World Bank(3.0) | deadline=9d(very_urgent=3.0) | TOTAL=0.0 → NO GO (disqualified)
12503,415,worldbank,"Bangladesh Sustainable Recovery, Emergency Preparedness and Response Project",Bangladesh,"[""Social Protection & Poverty Reduction"", ""Environment & Climate""]",WORKS,,,19,open,procurement,Invitation for Bids,Request for Bids,Bangladesh Water Development Board,World Bank,nlp_complete,0,proc_group=WORKS(DISQUALIFIED) | sector=Social Protection & Poverty Reduction(1.5) | budget=unknown(1.0) | country=Bangladesh(tier3=1.0) | funding_agency=World Bank(3.0) | deadline=19d(urgent=2.0) | TOTAL=0.0 → NO GO (disqualified)
12504,416,worldbank,Improvement of Solid Waste Management to Support Regional and Metropolitan Cities,Indonesia,"[""Water, Sanitation & Waste""]",GOODS,,,15,open,procurement,Invitation for Bids,Request for Bids,Balai Prasana Permukiman Wilayah Jawa timur,World Bank,nlp_complete,0,"proc_group=GOODS(DISQUALIFIED) | sector=Water, Sanitation & Waste(1.0) | budget=unknown(1.0) | country=Indonesia(tier3=1.0) | funding_agency=World Bank(3.0) | deadline=15d(urgent=2.0) | TOTAL=0.0 → NO GO (disqualified)"
12505,417,worldbank,Southeastern Corridor Road Asset Management Project,Liberia,"[""Transport & Logistics""]",CONSULTING,,,10,open,procurement,Expression of Interest,Quality and Cost-Based Selection,Infrastructure Implementation Unit,World Bank,nlp_complete,1,proc_group=CONSULTING(3.0) | sector=Transport & Logistics(1.0) | budget=unknown(1.0) | country=Liberia(tier1=3.0) | funding_agency=World Bank(3.0) | deadline=10d(very_urgent=3.0) | TOTAL=14.0/13.0 → GO
12506,418,worldbank,Economic Transformation for Inclusive Growth Project,Madagascar,"[""Social Protection & Poverty Reduction"", ""Digital Transformation""]",WORKS,78730.0,DZD,5,open,procurement,Invitation for Bids,Request for Bids,Economic Transformation for Inclusive Growth,World Bank,nlp_complete,0,proc_group=WORKS(DISQUALIFIED) | sector=Digital Transformation(3.0) | budget=small(543€)(0.5) | country=Madagascar(tier1=3.0) | funding_agency=World Bank(3.0) | deadline=5d(too_urgent=DISQUALIFIED) | TOTAL=0.0 → NO GO (disqualified)
12507,419,worldbank,Sub-Saharan Africa Women’s Empowerment and Demographic Dividend Plus Project,Western And Central Africa,"[""Social Protection & Poverty Reduction""]",GOODS,150000.0,XOF,5,open,procurement,Invitation for Bids,Request for Bids,Sahel Women’s Empowerment and Demographics Project Chad,World Bank,nlp_complete,0,proc_group=GOODS(DISQUALIFIED) | sector=Social Protection & Poverty Reduction(1.5) | budget=small(225€)(0.5) | country=Western And Central Africa(tier1=3.0) | funding_agency=World Bank(3.0) | deadline=5d(too_urgent=DISQUALIFIED) | TOTAL=0.0 → NO GO (disqualified)
12508,420,worldbank,"Bangladesh Sustainable Recovery, Emergency Preparedness and Response Project",Bangladesh,"[""Social Protection & Poverty Reduction"", ""Environment & Climate""]",WORKS,,,19,open,procurement,Invitation for Bids,Request for Bids,Bangladesh Water Development Board,World Bank,nlp_complete,0,proc_group=WORKS(DISQUALIFIED) | sector=Social Protection & Poverty Reduction(1.5) | budget=unknown(1.0) | country=Bangladesh(tier3=1.0) | funding_agency=World Bank(3.0) | deadline=19d(urgent=2.0) | TOTAL=0.0 → NO GO (disqualified)
12509,421,worldbank,Assam: School Education and Adolescent Wellbeing Project (ASAP),India,"[""Education & Training""]",CONSULTING,,,19,open,procurement,Expression of Interest,Quality and Cost-Based Selection,"Samagra Shiksha , State Mission Office",World Bank,nlp_complete,0,proc_group=CONSULTING(3.0) | sector=Education & Training(1.0) | budget=unknown(1.0) | country=India(tier3=1.0) | funding_agency=World Bank(3.0) | deadline=19d(urgent=2.0) | TOTAL=11.0/13.0 → NO GO
12510,422,worldbank,Rwanda Renewable Energy Development Project,Rwanda,"[""Energy & Utilities""]",CONSULTING,,,11,open,procurement,Expression of Interest,Consultant Qualification  Selection,Rwanda Energy Group - Energy Development Corporation Limited,World Bank,nlp_complete,1,proc_group=CONSULTING(3.0) | sector=Energy & Utilities(1.0) | budget=unknown(1.0) | country=Rwanda(tier1=3.0) | funding_agency=World Bank(3.0) | deadline=11d(very_urgent=3.0) | TOTAL=14.0/13.0 → GO
12511,423,worldbank,Clean Energy for Buildings in Uzbekistan,Uzbekistan,"[""Energy & Utilities""]",WORKS,,,7,open,procurement,Invitation for Prequalification,Request for Proposals,"Ministry of Economy and Finance, Republic of Uzbekistan",World Bank,nlp_complete,0,proc_group=WORKS(DISQUALIFIED) | sector=Energy & Utilities(1.0) | budget=unknown(1.0) | country=Uzbekistan(tier3=1.0) | funding_agency=World Bank(3.0) | deadline=7d(very_urgent=3.0) | TOTAL=0.0 → NO GO (disqualified)
12512,424,worldbank,Djibouti Health System Strengthening,Djibouti,"[""Health & Life Sciences""]",GOODS,,,13,open,procurement,Invitation for Bids,Request for Bids,Republic of Djibouti - Ministry of Health,World Bank,nlp_complete,0,proc_group=GOODS(DISQUALIFIED) | sector=Health & Life Sciences(1.0) | budget=unknown(1.0) | country=Djibouti(tier1=3.0) | funding_agency=World Bank(3.0) | deadline=13d(very_urgent=3.0) | TOTAL=0.0 → NO GO (disqualified)
12513,425,worldbank,"MV: Digital Maldives for Adaptation, Decentralization and Diversification",Maldives,"[""Digital Transformation""]",GOODS,,,13,open,procurement,Invitation for Bids,Request for Bids,Ministry of Homeland Security and Technology,World Bank,nlp_complete,0,proc_group=GOODS(DISQUALIFIED) | sector=Digital Transformation(3.0) | budget=unknown(1.0) | country=Maldives(tier3=1.0) | funding_agency=World Bank(3.0) | deadline=13d(very_urgent=3.0) | TOTAL=0.0 → NO GO (disqualified)
12514,426,worldbank,Enhancing Collection of Revenue and Expenditure Management Project,Congo,"[""Financial Services""]",GOODS,,,10,open,procurement,Invitation for Bids,Request for Bids,Comité d'Orientation de la Reforme des Finances Publiques,World Bank,nlp_complete,0,proc_group=GOODS(DISQUALIFIED) | sector=Financial Services(3.0) | budget=unknown(1.0) | country=Congo(tier1=3.0) | funding_agency=World Bank(3.0) | deadline=10d(very_urgent=3.0) | TOTAL=0.0 → NO GO (disqualified)
12515,427,worldbank,Strengthening Coastal Resilience and the Economy Project,India,"[""Environment & Climate""]",CONSULTING,,,7,open,procurement,Expression of Interest,Quality and Cost-Based Selection,Tamil Nadu Coastal Restoration Mission,World Bank,nlp_complete,0,proc_group=CONSULTING(3.0) | sector=Environment & Climate(1.0) | budget=unknown(1.0) | country=India(tier3=1.0) | funding_agency=World Bank(3.0) | deadline=7d(very_urgent=3.0) | TOTAL=12.0/13.0 → NO GO
12516,428,worldbank,Food Systems Resilience Program for Eastern and Southern Africa,Eastern And Southern Africa,"[""Agriculture & Food Security""]",WORKS,1000.0,ETB,8,open,procurement,Invitation for Bids,Request for Bids,Oromia Region Woreda-FSRP,World Bank,nlp_complete,0,proc_group=WORKS(DISQUALIFIED) | sector=Agriculture & Food Security(1.0) | budget=small(920€)(0.5) | country=Eastern And Southern Africa(tier1=3.0) | funding_agency=World Bank(3.0) | deadline=8d(very_urgent=3.0) | TOTAL=0.0 → NO GO (disqualified)
12517,429,worldbank,"Phase 3 Advancing Sustainability in Performance, Infrastructure, and Reliability of the Energy Secto",Palestinian Territory,"[""Energy & Utilities""]",GOODS,85000.0,USD,14,open,procurement,Invitation for Bids,Request for Bids,Palestinian Energy and Natural Resources Authority,World Bank,nlp_complete,0,"proc_group=GOODS(DISQUALIFIED) | sector=Energy & Utilities(1.0) | budget=small(78,200€)(0.5) | country=Palestinian Territory(tier2=2.0) | funding_agency=World Bank(3.0) | deadline=14d(very_urgent=3.0) | TOTAL=0.0 → NO GO (disqualified)"
12518,430,worldbank,Sub-Saharan Africa Women’s Empowerment and Demographic Dividend Plus Project,Western And Central Africa,"[""Social Protection & Poverty Reduction""]",GOODS,150000.0,XOF,6,open,procurement,Invitation for Bids,Request for Bids,Sahel Women’s Empowerment and Demographics Project Chad,World Bank,nlp_complete,0,proc_group=GOODS(DISQUALIFIED) | sector=Social Protection & Poverty Reduction(1.5) | budget=small(225€)(0.5) | country=Western And Central Africa(tier1=3.0) | funding_agency=World Bank(3.0) | deadline=6d(too_urgent=DISQUALIFIED) | TOTAL=0.0 → NO GO (disqualified)
12519,431,worldbank,Enhancing Collection of Revenue and Expenditure Management Project,Congo,"[""Financial Services""]",GOODS,2600000.0,USD,10,open,procurement,Invitation for Bids,Request for Bids,Comité d'Orientation de la Reforme des Finances Publiques,World Bank,nlp_complete,0,"proc_group=GOODS(DISQUALIFIED) | sector=Financial Services(3.0) | budget=large(2,392,000€)(3.0) | country=Congo(tier1=3.0) | funding_agency=World Bank(3.0) | deadline=10d(very_urgent=3.0) | TOTAL=0.0 → NO GO (disqualified)"
12520,432,worldbank,Albania National Water Supply and Sanitation Sector Modernization Program,Albania,"[""Water, Sanitation & Waste""]",CONSULTING,75000000.0,USD,17,open,procurement,Expression of Interest,Individual Consultant Selection,"Agency for Water Supply, Sanitation and Waste",World Bank,nlp_complete,1,"proc_group=CONSULTING(3.0) | sector=Water, Sanitation & Waste(1.0) | budget=large(69,000,000€)(3.0) | country=Albania(tier2=2.0) | funding_agency=World Bank(3.0) | deadline=17d(urgent=2.0) | TOTAL=14.0/13.0 → GO"
12521,433,worldbank,Improvement of Solid Waste Management to Support Regional and Metropolitan Cities,Indonesia,"[""Water, Sanitation & Waste""]",GOODS,,,15,open,procurement,Invitation for Bids,Request for Bids,Balai Prasana Permukiman Wilayah Jawa timur,World Bank,nlp_complete,0,"proc_group=GOODS(DISQUALIFIED) | sector=Water, Sanitation & Waste(1.0) | budget=unknown(1.0) | country=Indonesia(tier3=1.0) | funding_agency=World Bank(3.0) | deadline=15d(urgent=2.0) | TOTAL=0.0 → NO GO (disqualified)"
12522,434,worldbank,Kerala Solid Waste Management Project,India,"[""Water, Sanitation & Waste""]",GOODS,,,18,open,procurement,Invitation for Bids,Request for Quotations,Thodupuzha Municipality,World Bank,nlp_complete,0,"proc_group=GOODS(DISQUALIFIED) | sector=Water, Sanitation & Waste(1.0) | budget=unknown(1.0) | country=India(tier3=1.0) | funding_agency=World Bank(3.0) | deadline=18d(urgent=2.0) | TOTAL=0.0 → NO GO (disqualified)"
12523,435,worldbank,Horn of Africa - Groundwater for Resilience Program,Eastern And Southern Africa,"[""Environment & Climate""]",GOODS,,,12,open,procurement,Invitation for Bids,Request for Bids,Ministry of Energy and Water Resource,World Bank,nlp_complete,0,proc_group=GOODS(DISQUALIFIED) | sector=Environment & Climate(1.0) | budget=unknown(1.0) | country=Eastern And Southern Africa(tier1=3.0) | funding_agency=World Bank(3.0) | deadline=12d(very_urgent=3.0) | TOTAL=0.0 → NO GO (disqualified)
12524,436,worldbank,Food Systems Resilience Program for Eastern and Southern Africa,Eastern And Southern Africa,"[""Agriculture & Food Security""]",NON-CONSULTING,,,11,open,procurement,Invitation for Bids,Request for Bids,Food Systems Resilience Program for Eastern and Southern Africa - Madagascar,World Bank,nlp_complete,0,proc_group=NON-CONSULTING(1.0) | sector=Agriculture & Food Security(1.0) | budget=unknown(1.0) | country=Eastern And Southern Africa(tier1=3.0) | funding_agency=World Bank(3.0) | deadline=11d(very_urgent=3.0) | TOTAL=12.0/13.0 → NO GO
12525,437,worldbank,Fourth Public Sector Modernization Project,Armenia,"[""Government Reform & Public Administration""]",GOODS,10000.0,EUR,2,open,procurement,Invitation for Bids,Request for Proposals,Office of the Prime Minister,World Bank,nlp_complete,0,"proc_group=GOODS(DISQUALIFIED) | sector=Government Reform & Public Administration(3.0) | budget=small(10,000€)(0.5) | country=Armenia(tier2=2.0) | funding_agency=World Bank(3.0) | deadline=2d(too_urgent=DISQUALIFIED) | TOTAL=0.0 → NO GO (disqualified)"
12526,438,worldbank,Clean and Resilient Environment for Blue Sea Project,Albania,"[""Environment & Climate""]",CONSULTING,75000000.0,USD,19,open,procurement,Expression of Interest,Individual Consultant Selection,"Agency for Water Supply, Sanitation and Waste",World Bank,nlp_complete,1,"proc_group=CONSULTING(3.0) | sector=Environment & Climate(1.0) | budget=large(69,000,000€)(3.0) | country=Albania(tier2=2.0) | funding_agency=World Bank(3.0) | deadline=19d(urgent=2.0) | TOTAL=14.0/13.0 → GO"
12527,439,worldbank,Khyber Pakhtunkhwa Rural Investment and Institutional Support Project,Pakistan,"[""Social Protection & Poverty Reduction"", ""Agriculture & Food Security""]",CONSULTING,,,17,open,procurement,Expression of Interest,Individual Consultant Selection,Project Coordination and Management Unit- KP RIISP,World Bank,nlp_complete,0,proc_group=CONSULTING(3.0) | sector=Social Protection & Poverty Reduction(1.5) | budget=unknown(1.0) | country=Pakistan(tier3=1.0) | funding_agency=World Bank(3.0) | deadline=17d(urgent=2.0) | TOTAL=11.5/13.0 → NO GO
12528,440,worldbank,Sudan - Enhancing Community Resilience Project,Sudan,"[""Social Protection & Poverty Reduction""]",NON-CONSULTING,500000.0,USD,7,open,procurement,Invitation for Bids,Request for Bids,Mercy Corps,World Bank,nlp_complete,1,"proc_group=NON-CONSULTING(1.0) | sector=Social Protection & Poverty Reduction(1.5) | budget=medium(460,000€)(2.0) | country=Sudan(tier1=3.0) | funding_agency=World Bank(3.0) | deadline=7d(very_urgent=3.0) | TOTAL=13.5/13.0 → GO"
12529,441,worldbank,Eastern Africa Regional Statistics Program-for-Results,Eastern And Southern Africa,"[""Data, AI & Analytics""]",GOODS,,,4,open,procurement,Invitation for Bids,Request for Bids,Institut National de la Statistique du BurundiInstitut National de la Statistique du Burundi,World Bank,nlp_complete,0,"proc_group=GOODS(DISQUALIFIED) | sector=Data, AI & Analytics(2.0) | budget=unknown(1.0) | country=Eastern And Southern Africa(tier1=3.0) | funding_agency=World Bank(3.0) | deadline=4d(too_urgent=DISQUALIFIED) | TOTAL=0.0 → NO GO (disqualified)"
12530,442,worldbank,Improving Power System Resilience for European Power Grid Integration Project,Ukraine,"[""Energy & Utilities""]",WORKS,100000000.0,USD,21,open,procurement,Invitation for Bids,Request for Bids,PRIVATE JOINT STOCK COMPANY “UKRHYDROENERGO”,World Bank,nlp_complete,0,"proc_group=WORKS(DISQUALIFIED) | sector=Energy & Utilities(1.0) | budget=large(92,000,000€)(3.0) | country=Ukraine(tier2=2.0) | funding_agency=World Bank(3.0) | deadline=21d(urgent=2.0) | TOTAL=0.0 → NO GO (disqualified)"
12531,443,worldbank,Ukraine Improving Higher Education for Results Project,Ukraine,"[""Education & Training""]",GOODS,,,13,open,procurement,Invitation for Bids,Request for Quotations,Ministry of Education and Science of Ukraine,World Bank,nlp_complete,0,proc_group=GOODS(DISQUALIFIED) | sector=Education & Training(1.0) | budget=unknown(1.0) | country=Ukraine(tier2=2.0) | funding_agency=World Bank(3.0) | deadline=13d(very_urgent=3.0) | TOTAL=0.0 → NO GO (disqualified)
12532,444,worldbank,Assam: School Education and Adolescent Wellbeing Project (ASAP),India,"[""Education & Training""]",CONSULTING,,,19,open,procurement,Expression of Interest,Quality and Cost-Based Selection,"Samagra Shiksha , State Mission Office",World Bank,nlp_complete,0,proc_group=CONSULTING(3.0) | sector=Education & Training(1.0) | budget=unknown(1.0) | country=India(tier3=1.0) | funding_agency=World Bank(3.0) | deadline=19d(urgent=2.0) | TOTAL=11.0/13.0 → NO GO
12533,445,worldbank,Rwanda Quality Basic Education for Human Capital Development Project,Rwanda,"[""Education & Training""]",CONSULTING,,,20,open,procurement,Expression of Interest,Quality and Cost-Based Selection,National Examinations and School Inspection Authority,World Bank,nlp_complete,1,proc_group=CONSULTING(3.0) | sector=Education & Training(1.0) | budget=unknown(1.0) | country=Rwanda(tier1=3.0) | funding_agency=World Bank(3.0) | deadline=20d(urgent=2.0) | TOTAL=13.0/13.0 → GO
12534,446,worldbank,Accelerating Transport and Trade Connectivity in Eastern South Asia – Nepal Phase 1 Project,Nepal,"[""Transport & Logistics""]",WORKS,1100000.0,USD,14,open,procurement,Invitation for Bids,Request for Bids,Department of Roads,World Bank,nlp_complete,0,"proc_group=WORKS(DISQUALIFIED) | sector=Transport & Logistics(1.0) | budget=large(1,012,000€)(3.0) | country=Nepal(tier3=1.0) | funding_agency=World Bank(3.0) | deadline=14d(very_urgent=3.0) | TOTAL=0.0 → NO GO (disqualified)"
12535,447,worldbank,Strengthening Resilience of the Agriculture Sector Project,Tajikistan,"[""Agriculture & Food Security""]",GOODS,,,1,open,procurement,Invitation for Bids,Request for Bids,Project Implementation Unit under the Ministry of Agriculture of the Republic of Tajikistan,World Bank,nlp_complete,0,proc_group=GOODS(DISQUALIFIED) | sector=Agriculture & Food Security(1.0) | budget=unknown(1.0) | country=Tajikistan(tier3=1.0) | funding_agency=World Bank(3.0) | deadline=1d(too_urgent=DISQUALIFIED) | TOTAL=0.0 → NO GO (disqualified)
12536,448,worldbank,"Health Emergency Preparedness, Response and Resilience Program Using the Multiphase Programmatic App",Eastern And Southern Africa,"[""Environment & Climate"", ""Health & Life Sciences""]",GOODS,,,20,open,procurement,Invitation for Bids,Request for Bids,The Kenya Biovax Institute Limited,World Bank,nlp_complete,0,proc_group=GOODS(DISQUALIFIED) | sector=Environment & Climate(1.0) | budget=unknown(1.0) | country=Eastern And Southern Africa(tier1=3.0) | funding_agency=World Bank(3.0) | deadline=20d(urgent=2.0) | TOTAL=0.0 → NO GO (disqualified)
12537,449,worldbank,West Africa Food System Resilience Program (FSRP) Phase 2,Western And Central Africa,"[""Agriculture & Food Security""]",NON-CONSULTING,,,6,open,procurement,Invitation for Bids,Request for Bids,Ministry of Agriculture and Food Security,World Bank,nlp_complete,0,proc_group=NON-CONSULTING(1.0) | sector=Agriculture & Food Security(1.0) | budget=unknown(1.0) | country=Western And Central Africa(tier1=3.0) | funding_agency=World Bank(3.0) | deadline=6d(too_urgent=DISQUALIFIED) | TOTAL=0.0 → NO GO (disqualified)
12538,450,worldbank,NATIONAL AGRICULTURAL VALUE CHAIN DEVELOPMENT PROJECT (NAVCDP),Kenya,"[""Agriculture & Food Security""]",GOODS,,,13,open,procurement,Invitation for Bids,Request for Bids,STATE DEPARTMENT FOR AGRICULTURE,World Bank,nlp_complete,0,proc_group=GOODS(DISQUALIFIED) | sector=Agriculture & Food Security(1.0) | budget=unknown(1.0) | country=Kenya(tier1=3.0) | funding_agency=World Bank(3.0) | deadline=13d(very_urgent=3.0) | TOTAL=0.0 → NO GO (disqualified)
12539,451,worldbank,Türkiye Flood and Drought Management Project,Turkiye,"[""Water, Sanitation & Waste""]",CONSULTING,,,17,open,procurement,Expression of Interest,Consultant Qualification  Selection,Tarım ve Orman Bakanlığı Devlet Su İşleri Genel Müdürlüğü,World Bank,nlp_complete,0,"proc_group=CONSULTING(3.0) | sector=Water, Sanitation & Waste(1.0) | budget=unknown(1.0) | country=Turkiye(tier2=2.0) | funding_agency=World Bank(3.0) | deadline=17d(urgent=2.0) | TOTAL=12.0/13.0 → NO GO"
12540,452,worldbank,Inclusive Connectivity and Development Project,Sri Lanka,"[""Telecommunications""]",WORKS,,,13,open,procurement,Invitation for Bids,Request for Bids,Road Development Authority,World Bank,nlp_complete,0,proc_group=WORKS(DISQUALIFIED) | sector=Telecommunications(1.0) | budget=unknown(1.0) | country=Sri Lanka(tier3=1.0) | funding_agency=World Bank(3.0) | deadline=13d(very_urgent=3.0) | TOTAL=0.0 → NO GO (disqualified)
12541,453,worldbank,Public Financial Management for Development Effectiveness Project,Nepal,"[""Financial Services""]",GOODS,,,11,open,procurement,Invitation for Bids,Request for Bids,Office of the Auditor General,World Bank,nlp_complete,0,proc_group=GOODS(DISQUALIFIED) | sector=Financial Services(3.0) | budget=unknown(1.0) | country=Nepal(tier3=1.0) | funding_agency=World Bank(3.0) | deadline=11d(very_urgent=3.0) | TOTAL=0.0 → NO GO (disqualified)
12542,454,worldbank,Enhancing Connectivity in the Northern and Central Agricultural Production Areas of Senegal,Senegal,"[""Agriculture & Food Security""]",GOODS,100000000.0,XOF,7,open,procurement,Invitation for Bids,Request for Bids,AGEROUTE,World Bank,nlp_complete,0,"proc_group=GOODS(DISQUALIFIED) | sector=Agriculture & Food Security(1.0) | budget=medium(150,000€)(2.0) | country=Senegal(tier1=3.0) | funding_agency=World Bank(3.0) | deadline=7d(very_urgent=3.0) | TOTAL=0.0 → NO GO (disqualified)"
12543,455,worldbank,Nigeria: Improved Child Survival Program for Human Capital MPA,Nigeria,"[""Social Protection & Poverty Reduction""]",GOODS,,,6,open,procurement,Invitation for Bids,Request for Bids,Kano MPA,World Bank,nlp_complete,0,proc_group=GOODS(DISQUALIFIED) | sector=Social Protection & Poverty Reduction(1.5) | budget=unknown(1.0) | country=Nigeria(tier1=3.0) | funding_agency=World Bank(3.0) | deadline=6d(too_urgent=DISQUALIFIED) | TOTAL=0.0 → NO GO (disqualified)
12544,456,worldbank,Health Security Program in Western and Central Africa,Western And Central Africa,"[""Health & Life Sciences""]",GOODS,,,6,open,procurement,Invitation for Bids,Request for Bids,Unite de Gestion de Projets Sante,World Bank,nlp_complete,0,proc_group=GOODS(DISQUALIFIED) | sector=Health & Life Sciences(1.0) | budget=unknown(1.0) | country=Western And Central Africa(tier1=3.0) | funding_agency=World Bank(3.0) | deadline=6d(too_urgent=DISQUALIFIED) | TOTAL=0.0 → NO GO (disqualified)
12545,457,worldbank,Moldova Rural Connectivity Project,Republic of Moldova,"[""Telecommunications""]",WORKS,,,2,open,procurement,Invitation for Bids,Request for Bids,SE State Road Administration,World Bank,nlp_complete,0,proc_group=WORKS(DISQUALIFIED) | sector=Telecommunications(1.0) | budget=unknown(1.0) | country=Republic of Moldova(tier2=2.0) | funding_agency=World Bank(3.0) | deadline=2d(too_urgent=DISQUALIFIED) | TOTAL=0.0 → NO GO (disqualified)
