id,tender_id,source_portal,title_clean,country_name_normalized,sector,procurement_group,budget,currency,days_to_deadline,status_normalized,lifecycle_stage,notice_type_normalized,procurement_method_name,organisation_name,funding_agency,enrichment_status,go_no_go,score_breakdown
12928,840,undp,National AI Literacy and Applied Skills Training,Uganda,"[""Education & Training""]",Others,,,7,open,procurement,Request for Proposals,RFP - Request for proposal,UNDP-UGA,United Nations Development Programme (UNDP),nlp_complete,0,proc_group=OTHERS(1.5) | sector=Education & Training(1.0) | budget=unknown(1.0) | country=Uganda(tier1=3.0) | funding_agency=United Nations Development Programme (UNDP)(3.0) | deadline=7d(very_urgent=3.0) | TOTAL=12.5/13.0 → NO GO
12929,841,undp,National Civil Engineer for Global Fund Project,South Sudan,"[""Construction & Infrastructure""]",Others,,,11,open,procurement,IC - Individual contractor,Individual Contractor,UNDP-SSD,United Nations Development Programme (UNDP),nlp_complete,0,proc_group=OTHERS(1.5) | sector=Construction & Infrastructure(1.0) | budget=unknown(1.0) | country=South Sudan(tier1=3.0) | funding_agency=United Nations Development Programme (UNDP)(3.0) | deadline=11d(very_urgent=3.0) | TOTAL=12.5/13.0 → NO GO
12930,842,undp,Purchase and delivery of refrigerated vehicles and machinery,Tajikistan,"[""Transport & Logistics""]",GOODS,,,7,open,procurement,Request for Quotation,RFQ - Request for quotation,UNDP-TJK,United Nations Development Programme (UNDP),nlp_complete,0,proc_group=GOODS(DISQUALIFIED) | sector=Transport & Logistics(1.0) | budget=unknown(1.0) | country=Tajikistan(tier3=1.0) | funding_agency=United Nations Development Programme (UNDP)(3.0) | deadline=7d(very_urgent=3.0) | TOTAL=0.0 → NO GO (disqualified)
12931,843,undp,RECRUTEMENT D'UN(e) CONSULTANT(e ) NATIONAL(E) ELABORATION DE LA STRATEGIE JEUNE,Central African Republic,"[""Digital Transformation""]",CONSULTING,,,8,open,procurement,IC - Individual contractor,Individual Contractor,UNDP-CAF,United Nations Development Programme (UNDP),nlp_complete,1,proc_group=CONSULTING(3.0) | sector=Digital Transformation(3.0) | budget=unknown(1.0) | country=Central African Republic(tier1=3.0) | funding_agency=United Nations Development Programme (UNDP)(3.0) | deadline=8d(very_urgent=3.0) | TOTAL=16.0/13.0 → GO
12932,844,undp,Rehabilitation of Atauro Solar-Powered Water Supply Network,Timor Leste,"[""Energy & Utilities""]",WORKS,,,4,open,procurement,Invitation for Bids,ITB - Invitation to bid,UNDP-TLS,United Nations Development Programme (UNDP),nlp_complete,0,proc_group=WORKS(DISQUALIFIED) | sector=Energy & Utilities(1.0) | budget=unknown(1.0) | country=Timor Leste(tier3=1.0) | funding_agency=United Nations Development Programme (UNDP)(3.0) | deadline=4d(too_urgent=DISQUALIFIED) | TOTAL=0.0 → NO GO (disqualified)
12933,845,undp,Supply and Delivery of Sewing Machine and Accessories in Caloocan City,Philippines,"[""Others""]",GOODS,,,6,open,procurement,Request for Quotation,RFQ - Request for quotation,UNDP-PHL,United Nations Development Programme (UNDP),nlp_complete,0,proc_group=GOODS(DISQUALIFIED) | sector=Others(0.0) | budget=unknown(1.0) | country=Philippines(tier3=1.0) | funding_agency=United Nations Development Programme (UNDP)(3.0) | deadline=6d(too_urgent=DISQUALIFIED) | TOTAL=0.0 → NO GO (disqualified)
12934,846,undp,Supply of ICT and Connectivity Equipment - National Firms,Ethiopia,"[""Telecommunications""]",GOODS,,,12,open,procurement,Request for Quotation,RFQ - Request for quotation,UNDP-ETH,United Nations Development Programme (UNDP),nlp_complete,0,proc_group=GOODS(DISQUALIFIED) | sector=Telecommunications(1.0) | budget=unknown(1.0) | country=Ethiopia(tier1=3.0) | funding_agency=United Nations Development Programme (UNDP)(3.0) | deadline=12d(very_urgent=3.0) | TOTAL=0.0 → NO GO (disqualified)
12935,847,undp,"""Asistencia Técnica Modelo Proceso Téc. Archivístico"" CI 3594/26",Guatemala,"[""Others""]",CONSULTING,,,4,open,procurement,IC - Individual contractor,Individual Contractor,UNDP-GTM,United Nations Development Programme (UNDP),nlp_complete,0,proc_group=CONSULTING(3.0) | sector=Others(0.0) | budget=unknown(1.0) | country=Guatemala(tier3=1.0) | funding_agency=United Nations Development Programme (UNDP)(3.0) | deadline=4d(too_urgent=DISQUALIFIED) | TOTAL=0.0 → NO GO (disqualified)
12936,848,undp,AGENCIA OPERADORA DE EVENTOS,Honduras,"[""Others""]",Others,,,13,open,procurement,Request for Quotation,RFQ - Request for quotation,UNDP-HND,United Nations Development Programme (UNDP),nlp_complete,0,proc_group=OTHERS(1.5) | sector=Others(0.0) | budget=unknown(1.0) | country=Honduras(tier3=1.0) | funding_agency=United Nations Development Programme (UNDP)(3.0) | deadline=13d(very_urgent=3.0) | TOTAL=9.5/13.0 → NO GO
12937,849,undp,Seguro Vehículos UNAH,Honduras,"[""Risk & Compliance""]",Others,,,2,open,procurement,Request for Quotation,RFQ - Request for quotation,UNDP-HND,United Nations Development Programme (UNDP),nlp_complete,0,proc_group=OTHERS(1.5) | sector=Risk & Compliance(3.0) | budget=unknown(1.0) | country=Honduras(tier3=1.0) | funding_agency=United Nations Development Programme (UNDP)(3.0) | deadline=2d(too_urgent=DISQUALIFIED) | TOTAL=0.0 → NO GO (disqualified)
12938,850,undp,RÉALISATION DES FORAGES ET OUVRAGES COMMUNAUTAIRES D’ALIMENTATION,Chad,"[""Organizational Reform & HR Management"", ""Government Reform & Public Administration""]",WORKS,,,1,open,procurement,Invitation for Bids,ITB - Invitation to bid,UNDP-TCD,United Nations Development Programme (UNDP),nlp_complete,0,proc_group=WORKS(DISQUALIFIED) | sector=Organizational Reform & HR Management(3.0) | budget=unknown(1.0) | country=Chad(tier1=3.0) | funding_agency=United Nations Development Programme (UNDP)(3.0) | deadline=1d(too_urgent=DISQUALIFIED) | TOTAL=0.0 → NO GO (disqualified)
12939,851,undp,Внутренняя и наружная уборка на территории здания ООН в г. Алматы,Kazakhstan,"[""Water, Sanitation & Waste""]",Others,,,0,open,procurement,Request for Quotation,RFQ - Request for quotation,UNDP-KAZ,United Nations Development Programme (UNDP),nlp_complete,0,"proc_group=OTHERS(1.5) | sector=Water, Sanitation & Waste(1.0) | budget=unknown(1.0) | country=Kazakhstan(tier3=1.0) | funding_agency=United Nations Development Programme (UNDP)(3.0) | deadline=0d(too_urgent=DISQUALIFIED) | TOTAL=0.0 → NO GO (disqualified)"
12940,852,undp,Agri-Tech firm to foster climate adaptation in the Cassava Value Chain.,Uganda,"[""Environment & Climate""]",Others,,,5,open,procurement,Request for Proposals,RFP - Request for proposal,UNDP-UGA,United Nations Development Programme (UNDP),nlp_complete,0,proc_group=OTHERS(1.5) | sector=Environment & Climate(1.0) | budget=unknown(1.0) | country=Uganda(tier1=3.0) | funding_agency=United Nations Development Programme (UNDP)(3.0) | deadline=5d(too_urgent=DISQUALIFIED) | TOTAL=0.0 → NO GO (disqualified)
12941,853,undp,Cabinet international_ blockchain de sécurisation & vérification des diplômes,Mauritania,"[""Risk & Compliance"", ""Cybersecurity & Data Security""]",Others,,,8,open,procurement,Request for Proposals,RFP - Request for proposal,UNDP-MRT,United Nations Development Programme (UNDP),nlp_complete,1,proc_group=OTHERS(1.5) | sector=Risk & Compliance(3.0) | budget=unknown(1.0) | country=Mauritania(tier1=3.0) | funding_agency=United Nations Development Programme (UNDP)(3.0) | deadline=8d(very_urgent=3.0) | TOTAL=14.5/13.0 → GO
12942,854,undp,Consultancy Service for the Formulation of Global Fund Funding Request for ATM,Indonesia,"[""Financial Services""]",CONSULTING,,,8,open,procurement,Request for Proposals,RFP - Request for proposal,UNDP-IDN,United Nations Development Programme (UNDP),nlp_complete,1,proc_group=CONSULTING(3.0) | sector=Financial Services(3.0) | budget=unknown(1.0) | country=Indonesia(tier3=1.0) | funding_agency=United Nations Development Programme (UNDP)(3.0) | deadline=8d(very_urgent=3.0) | TOTAL=14.0/13.0 → GO
12943,855,undp,Consultant international/National prise en charge médicale des femmes détenues,Algeria,"[""Health & Life Sciences""]",CONSULTING,,,12,open,procurement,IC - Individual contractor,Individual Contractor,UNDP-DZA,United Nations Development Programme (UNDP),nlp_complete,1,proc_group=CONSULTING(3.0) | sector=Health & Life Sciences(1.0) | budget=unknown(1.0) | country=Algeria(tier1=3.0) | funding_agency=United Nations Development Programme (UNDP)(3.0) | deadline=12d(very_urgent=3.0) | TOTAL=14.0/13.0 → GO
12944,856,undp,Contract Administration Construction of New Quay Wall- Aden,Yemen,"[""Construction & Infrastructure""]",WORKS,,,1,open,procurement,Request for Proposals,RFP - Request for proposal,UNDP-YEM,United Nations Development Programme (UNDP),nlp_complete,0,proc_group=WORKS(DISQUALIFIED) | sector=Construction & Infrastructure(1.0) | budget=unknown(1.0) | country=Yemen(tier2=2.0) | funding_agency=United Nations Development Programme (UNDP)(3.0) | deadline=1d(too_urgent=DISQUALIFIED) | TOTAL=0.0 → NO GO (disqualified)
12945,857,undp,IC 12/2026 - Consultor/a en uso sostenible en pesca continental,Argentina,"[""Agriculture & Food Security""]",CONSULTING,,,8,open,procurement,IC - Individual contractor,Individual Contractor,UNDP-ARG,United Nations Development Programme (UNDP),nlp_complete,0,proc_group=CONSULTING(3.0) | sector=Agriculture & Food Security(1.0) | budget=unknown(1.0) | country=Argentina(tier3=1.0) | funding_agency=United Nations Development Programme (UNDP)(3.0) | deadline=8d(very_urgent=3.0) | TOTAL=12.0/13.0 → NO GO
12946,858,undp,Consultoría (internacional) fortalecimiento sector de generacion de vacunas,Colombia,"[""Health & Life Sciences""]",CONSULTING,,,11,open,procurement,IC - Individual contractor,Individual Contractor,UNDP-COL,United Nations Development Programme (UNDP),nlp_complete,0,proc_group=CONSULTING(3.0) | sector=Health & Life Sciences(1.0) | budget=unknown(1.0) | country=Colombia(tier3=1.0) | funding_agency=United Nations Development Programme (UNDP)(3.0) | deadline=11d(very_urgent=3.0) | TOTAL=12.0/13.0 → NO GO
12947,859,undp,International Consultant – Feasibility Study and Impact Evaluation Design,Ukraine,"[""Risk & Compliance""]",CONSULTING,,,7,open,procurement,IC - Individual contractor,Individual Contractor,UNDP-UKR,United Nations Development Programme (UNDP),nlp_complete,1,proc_group=CONSULTING(3.0) | sector=Risk & Compliance(3.0) | budget=unknown(1.0) | country=Ukraine(tier2=2.0) | funding_agency=United Nations Development Programme (UNDP)(3.0) | deadline=7d(very_urgent=3.0) | TOTAL=15.0/13.0 → GO
12948,860,undp,"Intl Final Evaluation Consultant - Gutpela Solwara, Gutpela Bisnis Project",Papua New Guinea,"[""Risk & Compliance""]",CONSULTING,,,8,open,procurement,IC - Individual contractor,Individual Contractor,UNDP-PNG,United Nations Development Programme (UNDP),nlp_complete,1,proc_group=CONSULTING(3.0) | sector=Risk & Compliance(3.0) | budget=unknown(1.0) | country=Papua New Guinea(tier3=1.0) | funding_agency=United Nations Development Programme (UNDP)(3.0) | deadline=8d(very_urgent=3.0) | TOTAL=14.0/13.0 → GO
12949,861,undp,Civil Works- Phase 02 of Cleaning of Naher El Bared Riverbed,Lebanon,"[""Construction & Infrastructure""]",WORKS,,,15,open,procurement,Request for Quotation,RFQ - Request for quotation,UNDP-LBN,United Nations Development Programme (UNDP),nlp_complete,0,proc_group=WORKS(DISQUALIFIED) | sector=Construction & Infrastructure(1.0) | budget=unknown(1.0) | country=Lebanon(tier2=2.0) | funding_agency=United Nations Development Programme (UNDP)(3.0) | deadline=15d(urgent=2.0) | TOTAL=0.0 → NO GO (disqualified)
12950,862,undp,Lead National Determined Contributions (NDC)-CIP Development Consultant,Fiji,"[""Mining & Natural Resources""]",CONSULTING,,,9,open,procurement,IC - Individual contractor,Individual Contractor,UNDP-FJI,United Nations Development Programme (UNDP),nlp_complete,0,proc_group=CONSULTING(3.0) | sector=Mining & Natural Resources(1.0) | budget=unknown(1.0) | country=Fiji(tier3=1.0) | funding_agency=United Nations Development Programme (UNDP)(3.0) | deadline=9d(very_urgent=3.0) | TOTAL=12.0/13.0 → NO GO
12951,863,undp,Long-Term Agreement for Supply and Delivery of Distilled/Purified Drinking Water,Philippines,"[""Water, Sanitation & Waste""]",GOODS,,,8,open,procurement,Request for Quotation,RFQ - Request for quotation,UNDP-PHL,United Nations Development Programme (UNDP),nlp_complete,0,"proc_group=GOODS(DISQUALIFIED) | sector=Water, Sanitation & Waste(1.0) | budget=unknown(1.0) | country=Philippines(tier3=1.0) | funding_agency=United Nations Development Programme (UNDP)(3.0) | deadline=8d(very_urgent=3.0) | TOTAL=0.0 → NO GO (disqualified)"
12952,864,undp,Market and System-level Analysis: Baseline Insights from an In-depth Assessment,Myanmar,"[""Mining & Natural Resources"", ""Data, AI & Analytics""]",CONSULTING,,,0,open,procurement,Request for Proposals,RFP - Request for proposal,UNDP-MMR,United Nations Development Programme (UNDP),nlp_complete,0,"proc_group=CONSULTING(3.0) | sector=Data, AI & Analytics(2.0) | budget=unknown(1.0) | country=Myanmar(tier3=1.0) | funding_agency=United Nations Development Programme (UNDP)(3.0) | deadline=0d(too_urgent=DISQUALIFIED) | TOTAL=0.0 → NO GO (disqualified)"
12953,865,undp,Multifunctional space construction in NCEDI_Platform#5 Project,Armenia,"[""Construction & Infrastructure""]",WORKS,,,8,open,procurement,Request for Quotation,RFQ - Request for quotation,UNDP-ARM,United Nations Development Programme (UNDP),nlp_complete,0,proc_group=WORKS(DISQUALIFIED) | sector=Construction & Infrastructure(1.0) | budget=unknown(1.0) | country=Armenia(tier2=2.0) | funding_agency=United Nations Development Programme (UNDP)(3.0) | deadline=8d(very_urgent=3.0) | TOTAL=0.0 → NO GO (disqualified)
12954,866,undp,Personal Protective Equipment (PPE) for CCDAC Myanmar,China,"[""Risk & Compliance""]",GOODS,,,11,open,procurement,Request for Quotation,RFQ - Request for quotation,UNDP-CHN,United Nations Development Programme (UNDP),nlp_complete,0,proc_group=GOODS(DISQUALIFIED) | sector=Risk & Compliance(3.0) | budget=unknown(1.0) | country=China(tier3=1.0) | funding_agency=United Nations Development Programme (UNDP)(3.0) | deadline=11d(very_urgent=3.0) | TOTAL=0.0 → NO GO (disqualified)
12955,867,undp,Provision of Technical Consulting Services for Deir Ali Power Plant – Value For,Syrian Arab Republic,"[""Enterprise IT & Systems Implementation""]",CONSULTING,,,7,open,procurement,Request for Proposals,RFP - Request for proposal,UNDP-SYR,United Nations Development Programme (UNDP),nlp_complete,1,proc_group=CONSULTING(3.0) | sector=Enterprise IT & Systems Implementation(3.0) | budget=unknown(1.0) | country=Syrian Arab Republic(tier2=2.0) | funding_agency=United Nations Development Programme (UNDP)(3.0) | deadline=7d(very_urgent=3.0) | TOTAL=15.0/13.0 → GO
12956,868,undp,Recrutement d’un cabinet pour appuyer les plans de gestion de 4 aires pastorales,Mali,"[""Organizational Reform & HR Management"", ""Agriculture & Food Security""]",Others,,,8,open,procurement,Request for Proposals,RFP - Request for proposal,UNDP-MLI,United Nations Development Programme (UNDP),nlp_complete,1,proc_group=OTHERS(1.5) | sector=Organizational Reform & HR Management(3.0) | budget=unknown(1.0) | country=Mali(tier1=3.0) | funding_agency=United Nations Development Programme (UNDP)(3.0) | deadline=8d(very_urgent=3.0) | TOTAL=14.5/13.0 → GO
12957,869,undp,for the global branding system for the iCOAST Programme,Belize,"[""Marketing & Customer Experience""]",Others,,,0,open,procurement,Request for Proposals,RFP - Request for proposal,UNDP-HQ,United Nations Development Programme (UNDP),nlp_complete,0,proc_group=OTHERS(1.5) | sector=Marketing & Customer Experience(2.0) | budget=unknown(1.0) | country=Belize(tier3=1.0) | funding_agency=United Nations Development Programme (UNDP)(3.0) | deadline=0d(too_urgent=DISQUALIFIED) | TOTAL=0.0 → NO GO (disqualified)
12958,870,undp,RFQ- Supply and Delivery of staff wellbeing and breakroom items(Local Firm Only),Ethiopia,"[""Organizational Reform & HR Management""]",GOODS,,,12,open,procurement,Request for Quotation,RFQ - Request for quotation,UNDP-ETH,United Nations Development Programme (UNDP),nlp_complete,0,proc_group=GOODS(DISQUALIFIED) | sector=Organizational Reform & HR Management(3.0) | budget=unknown(1.0) | country=Ethiopia(tier1=3.0) | funding_agency=United Nations Development Programme (UNDP)(3.0) | deadline=12d(very_urgent=3.0) | TOTAL=0.0 → NO GO (disqualified)
12959,871,undp,Technical Services for Multi-Sectoral Value Chain Assessments and Design- 7 Lots,Syrian Arab Republic,"[""Data, AI & Analytics""]",Others,,,8,open,procurement,Request for Proposals,RFP - Request for proposal,UNDP-SYR,United Nations Development Programme (UNDP),nlp_complete,0,"proc_group=OTHERS(1.5) | sector=Data, AI & Analytics(2.0) | budget=unknown(1.0) | country=Syrian Arab Republic(tier2=2.0) | funding_agency=United Nations Development Programme (UNDP)(3.0) | deadline=8d(very_urgent=3.0) | TOTAL=12.5/13.0 → NO GO"
12960,872,undp,MoHP Capacity Building & Transition Planning under Global Fund,Nepal,"[""Business Strategy & Performance""]",CONSULTING,,,12,open,procurement,IC - Individual contractor,Individual Contractor,UNDP-NPL,United Nations Development Programme (UNDP),nlp_complete,1,proc_group=CONSULTING(3.0) | sector=Business Strategy & Performance(3.0) | budget=unknown(1.0) | country=Nepal(tier3=1.0) | funding_agency=United Nations Development Programme (UNDP)(3.0) | deadline=12d(very_urgent=3.0) | TOTAL=14.0/13.0 → GO
12961,873,undp,Identificación portafolio mitigación y análisis escenarios,Ecuador,"[""Risk & Compliance""]",Others,,,5,open,procurement,IC - Individual contractor,Individual Contractor,UNDP-ECU,United Nations Development Programme (UNDP),nlp_complete,0,proc_group=OTHERS(1.5) | sector=Risk & Compliance(3.0) | budget=unknown(1.0) | country=Ecuador(tier3=1.0) | funding_agency=United Nations Development Programme (UNDP)(3.0) | deadline=5d(too_urgent=DISQUALIFIED) | TOTAL=0.0 → NO GO (disqualified)
12962,874,undp,Servicio de extracción de ARN total y Secuenciación RNA-Seq,Ecuador,"[""Others""]",Others,,,11,open,procurement,Request for Quotation,RFQ - Request for quotation,UNDP-ECU,United Nations Development Programme (UNDP),nlp_complete,0,proc_group=OTHERS(1.5) | sector=Others(0.0) | budget=unknown(1.0) | country=Ecuador(tier3=1.0) | funding_agency=United Nations Development Programme (UNDP)(3.0) | deadline=11d(very_urgent=3.0) | TOTAL=9.5/13.0 → NO GO
12963,875,undp,"Insumos ""producción de semillas nativas""-2026",El Salvador,"[""Agriculture & Food Security""]",GOODS,,,11,open,procurement,Request for Quotation,RFQ - Request for quotation,UNDP-SLV,United Nations Development Programme (UNDP),nlp_complete,0,proc_group=GOODS(DISQUALIFIED) | sector=Agriculture & Food Security(1.0) | budget=unknown(1.0) | country=El Salvador(tier3=1.0) | funding_agency=United Nations Development Programme (UNDP)(3.0) | deadline=11d(very_urgent=3.0) | TOTAL=0.0 → NO GO (disqualified)
12964,876,undp,Various Materials for the CE Programme of Puerto Princesa City,Philippines,"[""Others""]",GOODS,,,20,open,procurement,Request for Quotation,RFQ - Request for quotation,UNDP-PHL,United Nations Development Programme (UNDP),nlp_complete,0,proc_group=GOODS(DISQUALIFIED) | sector=Others(0.0) | budget=unknown(1.0) | country=Philippines(tier3=1.0) | funding_agency=United Nations Development Programme (UNDP)(3.0) | deadline=20d(urgent=2.0) | TOTAL=0.0 → NO GO (disqualified)
12965,877,undp,ViaDinarica-RfQ-Development of a lookout on Vrbas River in Jajce Municipality,Bosnia And Herzegovina,"[""Others""]",Others,,,7,open,procurement,Request for Quotation,RFQ - Request for quotation,UNDP-BIH,United Nations Development Programme (UNDP),nlp_complete,0,proc_group=OTHERS(1.5) | sector=Others(0.0) | budget=unknown(1.0) | country=Bosnia And Herzegovina(tier2=2.0) | funding_agency=United Nations Development Programme (UNDP)(3.0) | deadline=7d(very_urgent=3.0) | TOTAL=10.5/13.0 → NO GO
12966,878,undp,Construction of Protection Wall projects in Chardara District of Following Kundu,Afghanistan,"[""Construction & Infrastructure""]",WORKS,,,5,open,procurement,Request for Quotation,RFQ - Request for quotation,UNDP-AFG,United Nations Development Programme (UNDP),nlp_complete,0,proc_group=WORKS(DISQUALIFIED) | sector=Construction & Infrastructure(1.0) | budget=unknown(1.0) | country=Afghanistan(tier3=1.0) | funding_agency=United Nations Development Programme (UNDP)(3.0) | deadline=5d(too_urgent=DISQUALIFIED) | TOTAL=0.0 → NO GO (disqualified)
12967,879,undp,Construction of Three Canal Lining projects in Baghlan,Afghanistan,"[""Construction & Infrastructure""]",WORKS,,,9,open,procurement,Request for Quotation,RFQ - Request for quotation,UNDP-AFG,United Nations Development Programme (UNDP),nlp_complete,0,proc_group=WORKS(DISQUALIFIED) | sector=Construction & Infrastructure(1.0) | budget=unknown(1.0) | country=Afghanistan(tier3=1.0) | funding_agency=United Nations Development Programme (UNDP)(3.0) | deadline=9d(very_urgent=3.0) | TOTAL=0.0 → NO GO (disqualified)
12968,880,undp,IC-Market & Demand Assessment for Micro-Takaful and Bundled Loan Products,Djibouti,"[""Financial Services""]",CONSULTING,,,9,open,procurement,IC - Individual contractor,Individual Contractor,UNDP-DJI,United Nations Development Programme (UNDP),nlp_complete,1,proc_group=CONSULTING(3.0) | sector=Financial Services(3.0) | budget=unknown(1.0) | country=Djibouti(tier1=3.0) | funding_agency=United Nations Development Programme (UNDP)(3.0) | deadline=9d(very_urgent=3.0) | TOTAL=16.0/13.0 → GO
12969,881,undp,MSME Digitalization Policy and GEDSI Assessment (IC),Philippines,"[""Digital Transformation""]",CONSULTING,,,8,open,procurement,IC - Individual contractor,Individual Contractor,UNDP-PHL,United Nations Development Programme (UNDP),nlp_complete,1,proc_group=CONSULTING(3.0) | sector=Digital Transformation(3.0) | budget=unknown(1.0) | country=Philippines(tier3=1.0) | funding_agency=United Nations Development Programme (UNDP)(3.0) | deadline=8d(very_urgent=3.0) | TOTAL=14.0/13.0 → GO
12970,882,undp,National Consultant for Place-to-Place Survey Bangladesh,Bangladesh,"[""Others""]",CONSULTING,,,9,open,procurement,IC - Individual contractor,Individual Contractor,UNDP-BGD,United Nations Development Programme (UNDP),nlp_complete,0,proc_group=CONSULTING(3.0) | sector=Others(0.0) | budget=unknown(1.0) | country=Bangladesh(tier3=1.0) | funding_agency=United Nations Development Programme (UNDP)(3.0) | deadline=9d(very_urgent=3.0) | TOTAL=11.0/13.0 → NO GO
12971,883,undp,and Upgrading of Addu and Fuvahmulah Nature Parks,Maldives,"[""Environment & Climate""]",WORKS,,,7,open,procurement,Invitation for Bids,ITB - Invitation to bid,UNDP-MDV,United Nations Development Programme (UNDP),nlp_complete,0,proc_group=WORKS(DISQUALIFIED) | sector=Environment & Climate(1.0) | budget=unknown(1.0) | country=Maldives(tier3=1.0) | funding_agency=United Nations Development Programme (UNDP)(3.0) | deadline=7d(very_urgent=3.0) | TOTAL=0.0 → NO GO (disqualified)
12972,884,undp,LTA for the Provision of Travel Management Services for Un Agencies,Panama,"[""Transport & Logistics""]",CONSULTING,,,6,open,procurement,Invitation for Bids,ITB - Invitation to bid,UNDP-R46,United Nations Development Programme (UNDP),nlp_complete,0,proc_group=CONSULTING(3.0) | sector=Transport & Logistics(1.0) | budget=unknown(1.0) | country=Panama(tier3=1.0) | funding_agency=United Nations Development Programme (UNDP)(3.0) | deadline=6d(too_urgent=DISQUALIFIED) | TOTAL=0.0 → NO GO (disqualified)
12973,885,undp,Закупка и поставка оборудования и рефрижераторных контейнеров для КазНИИВХ,Kazakhstan,"[""Water, Sanitation & Waste""]",Others,,,8,open,procurement,Request for Quotation,RFQ - Request for quotation,UNDP-KAZ,United Nations Development Programme (UNDP),nlp_complete,0,"proc_group=OTHERS(1.5) | sector=Water, Sanitation & Waste(1.0) | budget=unknown(1.0) | country=Kazakhstan(tier3=1.0) | funding_agency=United Nations Development Programme (UNDP)(3.0) | deadline=8d(very_urgent=3.0) | TOTAL=10.5/13.0 → NO GO"
12974,886,undp,Adaptation of national ISO/EN standards,Ukraine,"[""Others""]",Others,,,4,open,procurement,Request for Proposals,RFP - Request for proposal,UNDP-UKR,United Nations Development Programme (UNDP),nlp_complete,0,proc_group=OTHERS(1.5) | sector=Others(0.0) | budget=unknown(1.0) | country=Ukraine(tier2=2.0) | funding_agency=United Nations Development Programme (UNDP)(3.0) | deadline=4d(too_urgent=DISQUALIFIED) | TOTAL=0.0 → NO GO (disqualified)
12975,887,undp,Acquisition de matériel médico-technique et mobilier médical au profit du Centr,Burkina Faso,"[""Health & Life Sciences""]",GOODS,,,13,open,procurement,Request for Quotation,RFQ - Request for quotation,UNDP-BFA,United Nations Development Programme (UNDP),nlp_complete,0,proc_group=GOODS(DISQUALIFIED) | sector=Health & Life Sciences(1.0) | budget=unknown(1.0) | country=Burkina Faso(tier1=3.0) | funding_agency=United Nations Development Programme (UNDP)(3.0) | deadline=13d(very_urgent=3.0) | TOTAL=0.0 → NO GO (disqualified)
12976,888,undp,Acquisition et Installation Systeme photovoltaïque,Haiti,"[""Energy & Utilities""]",WORKS,,,1,open,procurement,Request for Quotation,RFQ - Request for quotation,UNDP-HTI,United Nations Development Programme (UNDP),nlp_complete,0,proc_group=WORKS(DISQUALIFIED) | sector=Energy & Utilities(1.0) | budget=unknown(1.0) | country=Haiti(tier3=1.0) | funding_agency=United Nations Development Programme (UNDP)(3.0) | deadline=1d(too_urgent=DISQUALIFIED) | TOTAL=0.0 → NO GO (disqualified)
